{
  "$schema": "https://json-schema.org/draft/2020-12/schema",
  "title": "SkyTek Scope of Work",
  "description": "Every field the SOW template uses. Each x-question is what to ask when the RFP does not answer it.",
  "type": "object",
  "additionalProperties": false,
  "required": [
    "sow_date",
    "client_name",
    "project_title",
    "vendor_name",
    "vendor_address",
    "vendor_signatory_name",
    "vendor_signatory_title",
    "executive_summary",
    "objectives",
    "vendor_overview",
    "client_overview",
    "functional_requirements",
    "phases",
    "deliverables",
    "acceptance_criteria",
    "success_criteria",
    "start_date",
    "end_date",
    "timeline",
    "vendor_roles",
    "project_type",
    "currency",
    "pricing_model",
    "payment_schedule",
    "payment_terms",
    "tax_treatment"
  ],
  "allOf": [
    {
      "if": { "properties": { "project_type": { "const": "package" } } },
      "then": { "required": ["package_items"], "not": { "required": ["effort"] } }
    },
    {
      "if": { "properties": { "project_type": { "const": "professional_services" } } },
      "then": { "required": ["effort"], "not": { "required": ["package_items"] } }
    }
  ],
  "$defs": {
    "text_list": {
      "type": "array",
      "items": { "type": "string", "minLength": 1 }
    },
    "named_item": {
      "type": "object",
      "additionalProperties": false,
      "required": ["name", "description"],
      "properties": {
        "name": { "type": "string", "minLength": 1 },
        "description": { "type": "string", "minLength": 1 }
      }
    },
    "role": {
      "type": "object",
      "additionalProperties": false,
      "required": ["role", "responsibilities"],
      "properties": {
        "role": { "type": "string", "minLength": 1 },
        "responsibilities": { "type": "string", "minLength": 1 }
      }
    }
  },
  "properties": {
    "sow_date": {
      "type": "string",
      "pattern": "^\\d{4}-\\d{2}-\\d{2}$",
      "description": "Date on the cover, YYYY-MM-DD. Also used in the file name.",
      "x-question": "What date should the SOW carry? (default: today)"
    },
    "version": {
      "type": "string",
      "default": "1.0",
      "description": "Document version on the cover.",
      "x-question": "Which document version is this? (default: 1.0)"
    },
    "author": {
      "type": "string",
      "default": "",
      "description": "Who wrote the SOW, shown on the cover. Empty omits the line.",
      "x-question": "Who should be named as the SOW's author?"
    },
    "client_logo_path": {
      "type": "string",
      "default": "",
      "description": "Local path to the client's logo (PNG or JPG; SVG cannot be embedded). Empty leaves a labelled placeholder on the cover.",
      "x-question": "Do you have the client's logo as a PNG or JPG to place on the cover? If so, its file path."
    },
    "client_name": {
      "type": "string",
      "minLength": 1,
      "description": "Client's legal name.",
      "x-question": "What is the client's legal name?"
    },
    "client_address": {
      "type": "string",
      "default": "",
      "description": "Client's address.",
      "x-question": "What is the client's address?"
    },
    "client_signatory_name": {
      "type": "string",
      "default": "",
      "description": "Who signs for the client. Blank leaves a line to fill by hand.",
      "x-question": "Who signs for the client, if known?"
    },
    "client_signatory_title": {
      "type": "string",
      "default": "",
      "description": "Job title of the client signatory.",
      "x-question": "What is the client signatory's title?"
    },
    "project_title": {
      "type": "string",
      "minLength": 1,
      "description": "Short project name on the cover and footer.",
      "x-question": "What is the project called?"
    },
    "vendor_name": {
      "type": "string",
      "minLength": 1,
      "description": "Vendor's legal name.",
      "x-question": "What is the vendor's legal name?"
    },
    "vendor_address": {
      "type": "string",
      "minLength": 1,
      "description": "Vendor's address.",
      "x-question": "What is the vendor's address?"
    },
    "vendor_signatory_name": {
      "type": "string",
      "minLength": 1,
      "description": "Who signs for the vendor.",
      "x-question": "Who signs for the vendor?"
    },
    "vendor_signatory_title": {
      "type": "string",
      "minLength": 1,
      "description": "Job title of the vendor signatory.",
      "x-question": "What is the vendor signatory's title?"
    },
    "msa_reference": {
      "type": "string",
      "default": "",
      "description": "The master agreement this SOW sits under, e.g. 'Master Services Agreement dated 1 March 2026'. Empty says the SOW stands alone.",
      "x-question": "Is there a master services agreement (MSA) this SOW falls under? If so, its name and date."
    },
    "governing_law": {
      "type": "string",
      "default": "",
      "description": "Jurisdiction, e.g. 'the Republic of Indonesia'. Empty omits the sentence.",
      "x-question": "Which jurisdiction's law governs this SOW, if stated?"
    },
    "executive_summary": {
      "type": "string",
      "minLength": 1,
      "description": "Business value of the engagement and a high-level view of the technical outcome. Line breaks are kept.",
      "x-question": "In a few sentences, what problem does the client need solved, and what will this engagement deliver?"
    },
    "objectives": {
      "$ref": "#/$defs/text_list",
      "minItems": 1,
      "description": "Outcomes the work must achieve, one per bullet.",
      "x-question": "What outcomes must this work achieve?"
    },
    "vendor_overview": {
      "type": "string",
      "minLength": 1,
      "description": "Three or four lines on the vendor's strengths, expertise and track record.",
      "x-question": "How should SkyTek be described in three or four lines (strengths, expertise, track record)?"
    },
    "client_overview": {
      "type": "string",
      "minLength": 1,
      "description": "The client, its industry, and its current technology relevant to this work.",
      "x-question": "Briefly, who is the client, what industry are they in, and what do they run today that this work touches?"
    },
    "functional_requirements": {
      "$ref": "#/$defs/text_list",
      "minItems": 1,
      "description": "What the solution does: features and behaviours, one per row.",
      "x-question": "What must the solution do (features, user actions, behaviours)?"
    },
    "non_functional_requirements": {
      "$ref": "#/$defs/text_list",
      "default": [],
      "description": "How well it does it: performance, security, availability, scale. Empty prints a fallback line.",
      "x-question": "Any non-functional requirements (performance, security, availability, scale)?"
    },
    "architecture_overview": {
      "type": "string",
      "default": "",
      "description": "Text overview of the target architecture. Empty prints a line deferring it to the technical design document.",
      "x-question": "Can you describe the target architecture at a high level?"
    },
    "architecture_components": {
      "type": "array",
      "default": [],
      "items": { "$ref": "#/$defs/named_item" },
      "description": "Core solution components and each one's role.",
      "x-question": "What are the main components of the solution, and what does each do?"
    },
    "integrations": {
      "type": "array",
      "default": [],
      "items": { "$ref": "#/$defs/named_item" },
      "description": "In-scope integrations with the client's systems: source, target and purpose.",
      "x-question": "Which of the client's existing systems does the solution integrate with?"
    },
    "phases": {
      "type": "array",
      "minItems": 1,
      "items": {
        "type": "object",
        "additionalProperties": false,
        "required": ["name", "focus", "tasks"],
        "properties": {
          "name": { "type": "string", "minLength": 1 },
          "focus": { "type": "string", "minLength": 1, "description": "One or two sentences on what the phase achieves." },
          "tasks": { "$ref": "#/$defs/text_list", "minItems": 1, "description": "Action-verb tasks: design, configure, migrate, test." }
        }
      },
      "description": "The work, as phases or workstreams, each with its key tasks.",
      "x-question": "How is the work split into phases (e.g. Discovery, Design, Build, UAT, Go-live), and what are the key tasks in each?"
    },
    "deliverables": {
      "type": "array",
      "minItems": 1,
      "items": {
        "type": "object",
        "additionalProperties": false,
        "required": ["phase", "name", "description"],
        "properties": {
          "phase": { "type": "string", "minLength": 1 },
          "name": { "type": "string", "minLength": 1 },
          "description": { "type": "string", "minLength": 1, "description": "Measurable: state counts, components or environments." },
          "format": { "type": "string", "default": "Document", "description": "e.g. Document, Presentation, Code in repository, Demonstration." }
        }
      },
      "description": "What is handed over, by phase, in which format.",
      "x-question": "What will be delivered in each phase, and in what format?"
    },
    "acceptance_criteria": {
      "type": "string",
      "minLength": 1,
      "description": "How the client accepts deliverables. Line breaks are kept.",
      "x-question": "How will the client accept deliverables (review window, sign-off)?"
    },
    "out_of_scope": {
      "$ref": "#/$defs/text_list",
      "default": [],
      "description": "Work explicitly excluded. Empty prints 'No exclusions specified.'",
      "x-question": "Is anything explicitly excluded?"
    },
    "assumptions": {
      "$ref": "#/$defs/text_list",
      "default": [
        "The Client provides access to the systems, environments and data the work needs before the relevant phase starts.",
        "The Client names a single point of contact and a project sponsor who serves as the escalation point.",
        "The Client makes subject-matter experts available for requirements, design and testing discussions.",
        "The Client makes project decisions within two (2) business days of a request.",
        "The Client is responsible for all cloud, licence and third-party usage fees.",
        "Delays on the Client's side may affect the timeline, the fees or both, and are handled through change control."
      ],
      "description": "Conditions the estimate depends on. Omitted uses the standard list; an empty list prints 'No assumptions specified.'",
      "x-question": "Use the standard assumptions (access, point of contact, SMEs, two-day decisions, client pays usage fees, delays go through change control), or add or change some?"
    },
    "risks": {
      "type": "array",
      "default": [],
      "items": {
        "type": "object",
        "additionalProperties": false,
        "required": ["risk", "mitigation"],
        "properties": {
          "risk": { "type": "string", "minLength": 1 },
          "mitigation": { "type": "string", "minLength": 1 }
        }
      },
      "description": "Shared project risks and how each is mitigated. Empty prints a fallback line.",
      "x-question": "What are the main project risks, and how will each be mitigated?"
    },
    "change_control": {
      "type": "string",
      "default": "Either party may request a change to this SOW in writing. The Vendor will assess the impact on scope, timeline and fees within five business days. No change takes effect until both parties sign a change order.",
      "description": "How scope changes are handled. Line breaks are kept.",
      "x-question": "Use the standard change-control clause, or a custom one?"
    },
    "success_criteria": {
      "$ref": "#/$defs/text_list",
      "minItems": 1,
      "description": "What a successful project looks like, aligned with the deliverables. 'Completion of all deliverables' is printed first automatically.",
      "x-question": "Beyond delivering everything listed, what measurable outcomes mark this project as a success?"
    },
    "start_date": {
      "type": "string",
      "minLength": 1,
      "description": "Estimated start, YYYY-MM-DD or free text.",
      "x-question": "When does the work start?"
    },
    "end_date": {
      "type": "string",
      "minLength": 1,
      "description": "Estimated end, YYYY-MM-DD or free text.",
      "x-question": "When does the work end?"
    },
    "timeline": {
      "type": "array",
      "minItems": 1,
      "items": {
        "type": "object",
        "additionalProperties": false,
        "required": ["phase", "period", "activities"],
        "properties": {
          "phase": { "type": "string", "minLength": 1 },
          "period": { "type": "string", "minLength": 1, "description": "e.g. 'Week 1', 'Weeks 2-5', or a date." },
          "activities": { "type": "string", "minLength": 1, "description": "Key outcomes or deliverables in that period." }
        }
      },
      "description": "Estimated schedule by phase.",
      "x-question": "Roughly which weeks does each phase cover, and what is done in each?"
    },
    "vendor_roles": {
      "type": "array",
      "minItems": 1,
      "items": { "$ref": "#/$defs/role" },
      "description": "Vendor team roles. Include project management. Mandays and rates belong in effort, not here.",
      "x-question": "Which roles will SkyTek staff (e.g. Engagement Manager, Solution Architect, Engineers), and what does each do?"
    },
    "client_roles": {
      "type": "array",
      "default": [],
      "items": { "$ref": "#/$defs/role" },
      "description": "Roles the client must provide. Empty prints a fallback line.",
      "x-question": "Which roles must the client provide (sponsor, product owner, SMEs), and what does each do?"
    },
    "project_type": {
      "type": "string",
      "enum": ["package", "professional_services"],
      "description": "package: a packaged solution priced by item, with no mandays. professional_services: priced by effort, role x mandays x day rate.",
      "x-question": "Is this a packaged solution (priced by item) or professional services (priced by mandays)?"
    },
    "package_items": {
      "type": "array",
      "minItems": 1,
      "items": {
        "type": "object",
        "additionalProperties": false,
        "required": ["item", "quantity", "unit_price"],
        "properties": {
          "item": { "type": "string", "minLength": 1 },
          "description": { "type": "string", "default": "" },
          "quantity": { "type": "number", "exclusiveMinimum": 0 },
          "unit_price": { "type": "number", "minimum": 0 }
        }
      },
      "description": "Package projects only: priced lines such as licences, subscriptions or a fixed setup fee. Amounts are computed.",
      "x-question": "What does the package include, in what quantity, at what unit price?"
    },
    "effort": {
      "type": "array",
      "minItems": 1,
      "items": {
        "type": "object",
        "additionalProperties": false,
        "required": ["role", "mandays", "day_rate"],
        "properties": {
          "role": { "type": "string", "minLength": 1 },
          "mandays": { "type": "number", "exclusiveMinimum": 0 },
          "day_rate": { "type": "number", "minimum": 0 }
        }
      },
      "description": "Professional-services projects only: mandays and day rate per role. Amounts, total mandays and total cost are computed.",
      "x-question": "How many mandays does each role need, and at what day rate?"
    },
    "currency": {
      "type": "string",
      "pattern": "^[A-Z]{3}$",
      "description": "ISO 4217 code, e.g. USD or IDR.",
      "x-question": "Which currency are fees in?"
    },
    "pricing_model": {
      "type": "string",
      "enum": ["fixed_price", "time_and_materials", "retainer"],
      "description": "How the work is billed.",
      "x-question": "Is this fixed price, time and materials, or a retainer?"
    },
    "fees": {
      "type": "array",
      "default": [],
      "items": {
        "type": "object",
        "additionalProperties": false,
        "required": ["item", "amount"],
        "properties": {
          "item": { "type": "string", "minLength": 1 },
          "amount": { "type": "number", "description": "Negative for a discount or vendor investment." }
        }
      },
      "description": "Extra lines on top of the package items or effort: discounts (negative), third-party costs, one-off fees. The total must not be negative.",
      "x-question": "Any other fees or discounts on top of that?"
    },
    "payment_schedule": {
      "type": "array",
      "minItems": 1,
      "items": {
        "type": "object",
        "additionalProperties": false,
        "required": ["milestone", "due", "amount"],
        "properties": {
          "milestone": { "type": "string", "minLength": 1 },
          "deliverables": { "type": "string", "default": "", "description": "Deliverables that must be accepted before this payment." },
          "due": { "type": "string", "description": "Estimated completion: date or free text." },
          "amount": { "type": "number", "minimum": 0 }
        }
      },
      "description": "When each payment is invoiced, and what it depends on.",
      "x-question": "When is each payment invoiced, for how much, and which deliverables does it depend on?"
    },
    "payment_terms": {
      "type": "string",
      "minLength": 1,
      "description": "e.g. 'Net 30 from invoice date'.",
      "x-question": "What are the payment terms (e.g. Net 30)?"
    },
    "expenses": {
      "type": "string",
      "default": "Expenses, where agreed in advance between the Client and the Vendor, are paid by the Client in line with the Client's expense reimbursement policy. Expenses invoiced by the Vendor that the Client does not object to in writing are payable.",
      "description": "Expense clause. Line breaks are kept.",
      "x-question": "Use the standard expenses clause (pre-agreed expenses reimbursed by the client), or a custom one?"
    },
    "tax_treatment": {
      "type": "string",
      "enum": ["exclusive", "inclusive"],
      "description": "Whether the fees include sales tax or VAT.",
      "x-question": "Are the fees exclusive or inclusive of sales tax / VAT?"
    },
    "_sources": {
      "type": "object",
      "default": {},
      "additionalProperties": { "enum": ["rfp", "user", "default", "inferred"] },
      "description": "Where each field's value came from. Not rendered.",
      "x-question": ""
    }
  }
}
