{
  "sow_date": "2026-10-09",
  "version": "1.0",
  "author": "Jane Doe",
  "client_name": "Acme Logistics Pte. Ltd.",
  "client_address": "1 Harbourfront Ave, Singapore 098632",
  "client_signatory_name": "Mei Lin Tan",
  "client_signatory_title": "Head of Operations",
  "project_title": "Fleet Tracking Platform Migration",
  "vendor_name": "SkyTek Labs",
  "vendor_address": "Jl. Sudirman Kav. 52-53, Jakarta 12190, Indonesia",
  "vendor_signatory_name": "Jane Doe",
  "vendor_signatory_title": "Managing Director",
  "msa_reference": "Master Services Agreement dated 2 March 2026",
  "governing_law": "the Republic of Singapore",
  "executive_summary": "Acme runs fleet tracking on a self-hosted platform that is near end of life.\nOutages during peak season & slow reports drive this migration to a managed cloud platform.",
  "objectives": [
    "Move fleet tracking to a managed cloud platform with no data loss",
    "Cut report generation time from hours to minutes",
    "Hand over runbooks so Acme's team can operate the platform"
  ],
  "vendor_overview": "SkyTek Labs is a cloud engineering firm based in Jakarta. It designs, migrates and operates data platforms for logistics and financial services clients across Southeast Asia.",
  "client_overview": "Acme Logistics runs a fleet of 1,200 vehicles across Singapore and Malaysia. Tracking runs on a self-hosted platform in a colocation facility.",
  "functional_requirements": [
    "Ingest GPS positions from all 1,200 vehicles every 30 seconds",
    "Generate daily route and fuel reports for operations managers",
    "Keep 3 years of tracking history queryable"
  ],
  "non_functional_requirements": [
    "Reports complete in under 5 minutes",
    "99.9% monthly availability for ingestion"
  ],
  "architecture_overview": "Vehicle telemetry streams into a managed message queue, lands in a time-series store, and feeds a reporting warehouse.",
  "architecture_components": [
    { "name": "Amazon Kinesis", "description": "Receives vehicle telemetry" },
    { "name": "Amazon Timestream", "description": "Stores position history" }
  ],
  "integrations": [
    { "name": "Fuel card system", "description": "Nightly import of fuel transactions into the reporting warehouse" }
  ],
  "phases": [
    {
      "name": "Discovery",
      "focus": "Assess the current platform and data, and agree the target design.",
      "tasks": ["Inventory current platform and data", "Document risks", "Design target architecture"]
    },
    {
      "name": "Migration",
      "focus": "Build the target platform and move 3 years of history onto it.",
      "tasks": ["Provision environments", "Migrate tracking history", "Run cut-over weekend"]
    },
    {
      "name": "Hypercare",
      "focus": "Stabilise the platform and hand it over to Acme's team.",
      "tasks": ["Monitor for two weeks", "Write runbooks", "Train operations staff"]
    }
  ],
  "deliverables": [
    { "phase": "Discovery", "name": "Assessment report", "description": "Current state, risks, data inventory", "format": "Document" },
    { "phase": "Discovery", "name": "Target architecture", "description": "Design document and cost model" },
    { "phase": "Migration", "name": "Migrated platform", "description": "Production environment with 3 years of migrated data", "format": "Deployed environment" },
    { "phase": "Hypercare", "name": "Runbooks", "description": "Operations and incident runbooks", "format": "Document" }
  ],
  "acceptance_criteria": "Acme reviews each deliverable within five business days of handover.\nA deliverable is accepted on written sign-off or when the review window passes without written objection.",
  "out_of_scope": [
    "Changes to in-vehicle hardware",
    "Mobile driver app redesign"
  ],
  "assumptions": [
    "Acme provides admin access to the current platform by kick-off",
    "Source data volume does not exceed 2 TB"
  ],
  "risks": [
    { "risk": "Source data quality is worse than expected", "mitigation": "Profile data in Discovery and agree clean-up rules before migration" }
  ],
  "success_criteria": [
    "All 1,200 vehicles reporting on the new platform",
    "Daily reports complete in under 5 minutes"
  ],
  "start_date": "2026-10-26",
  "end_date": "2027-02-26",
  "timeline": [
    { "phase": "Discovery", "period": "Weeks 1-5", "activities": "Assessment report, target architecture" },
    { "phase": "Migration", "period": "Weeks 6-14", "activities": "Migrated platform, go-live" },
    { "phase": "Hypercare", "period": "Week 18", "activities": "Runbooks, handover" }
  ],
  "vendor_roles": [
    { "role": "Engagement Manager", "responsibilities": "Runs the engagement, reporting and client alignment" },
    { "role": "Solution Architect", "responsibilities": "Leads design and technical decisions" }
  ],
  "client_roles": [
    { "role": "Project Sponsor", "responsibilities": "Escalation point; approves deliverables and change orders" }
  ],
  "project_type": "professional_services",
  "currency": "USD",
  "pricing_model": "fixed_price",
  "effort": [
    { "role": "Solution Architect", "mandays": 20, "day_rate": 900 },
    { "role": "Cloud Engineer", "mandays": 70, "day_rate": 600 },
    { "role": "Engagement Manager", "mandays": 10, "day_rate": 600 }
  ],
  "payment_schedule": [
    { "milestone": "Contract signature", "due": "2026-10-26", "amount": 19800 },
    { "milestone": "Design sign-off", "deliverables": "Assessment report, Target architecture", "due": "2026-11-27", "amount": 19800 },
    { "milestone": "Go-live", "deliverables": "Migrated platform", "due": "2027-01-29", "amount": 26400 }
  ],
  "payment_terms": "Net 30 from invoice date",
  "tax_treatment": "exclusive",
  "_sources": {
    "client_name": "rfp",
    "vendor_signatory_name": "default",
    "effort": "user",
    "currency": "rfp",
    "pricing_model": "rfp",
    "payment_schedule": "user",
    "payment_terms": "rfp",
    "tax_treatment": "user",
    "governing_law": "rfp"
  }
}
